{
  "categories": [
    {
      "description": "Área destinada a expositor, conforme a legenda do mapa.",
      "fillType": "horizontal-linear-gradient",
      "id": "exhibitor",
      "legendOrder": 1,
      "normalizedName": "expositor",
      "originalColor": {
        "gradientSamples": [
          "#CDDCE6",
          "#FDFEFE",
          "#D5E1E9"
        ],
        "representativeHex": "#DCE7EE"
      },
      "originalName": "EXPOSITOR",
      "relatedElementIds": [
        "poi-cabana-vermelha-k28",
        "poi-estudio-ton-47",
        "poi-guarderia-souvenirs-k75",
        "stand-a30",
        "stand-a40",
        "stand-a41",
        "stand-a47",
        "stand-a50",
        "stand-a58",
        "stand-a60",
        "stand-a66",
        "stand-a68",
        "stand-a70",
        "stand-a76",
        "stand-a78",
        "stand-a80",
        "stand-a81",
        "stand-a85",
        "stand-a86",
        "stand-a88",
        "stand-a89",
        "stand-aa01",
        "stand-aa03",
        "stand-aa05",
        "stand-aa10",
        "stand-aa18",
        "stand-aa20",
        "stand-aa27",
        "stand-aa28",
        "stand-aa41",
        "stand-aa45",
        "stand-b20",
        "stand-b38",
        "stand-b40",
        "stand-b60",
        "stand-b65",
        "stand-b68",
        "stand-b70",
        "stand-b78",
        "stand-b79",
        "stand-b80",
        "stand-b81",
        "stand-b88",
        "stand-bb10",
        "stand-bb16",
        "stand-bb18",
        "stand-bb20",
        "stand-bb28",
        "stand-bb29",
        "stand-c10",
        "stand-c20",
        "stand-c28",
        "stand-c30",
        "stand-c58",
        "stand-c60",
        "stand-c72",
        "stand-c76",
        "stand-c77",
        "stand-c80",
        "stand-c82",
        "stand-cc11",
        "stand-cc17",
        "stand-cc19",
        "stand-cc20",
        "stand-cc21",
        "stand-cc27",
        "stand-cc29",
        "stand-d10",
        "stand-d30",
        "stand-d40",
        "stand-d58",
        "stand-d60",
        "stand-d70",
        "stand-d77",
        "stand-d81",
        "stand-d88",
        "stand-dd11",
        "stand-dd21",
        "stand-dd29",
        "stand-e02",
        "stand-e10",
        "stand-e18",
        "stand-e20",
        "stand-e21",
        "stand-e30",
        "stand-e60",
        "stand-e70",
        "stand-e80",
        "stand-e82",
        "stand-e88",
        "stand-f02",
        "stand-f10",
        "stand-f11",
        "stand-f14",
        "stand-f18",
        "stand-f20",
        "stand-f28",
        "stand-f30",
        "stand-f40",
        "stand-f58",
        "stand-f60",
        "stand-f70",
        "stand-f76",
        "stand-f80",
        "stand-f82",
        "stand-f88",
        "stand-g03",
        "stand-g11",
        "stand-g15",
        "stand-g20",
        "stand-g26",
        "stand-g28",
        "stand-g30",
        "stand-g36",
        "stand-g40",
        "stand-g50",
        "stand-g52",
        "stand-g68",
        "stand-g70",
        "stand-g76",
        "stand-g80",
        "stand-g81",
        "stand-g82",
        "stand-g84",
        "stand-g88",
        "stand-h25",
        "stand-h34",
        "stand-h38",
        "stand-h40",
        "stand-h48",
        "stand-h50",
        "stand-h58",
        "stand-h60",
        "stand-h70",
        "stand-h76",
        "stand-h78",
        "stand-h80",
        "stand-h83",
        "stand-h85",
        "stand-h86",
        "stand-h87",
        "stand-j20",
        "stand-j26",
        "stand-j28",
        "stand-j30",
        "stand-j32",
        "stand-j33",
        "stand-j34",
        "stand-j36",
        "stand-j38",
        "stand-j40",
        "stand-j44",
        "stand-j48",
        "stand-j52",
        "stand-j58",
        "stand-j60",
        "stand-j66",
        "stand-j68",
        "stand-j70",
        "stand-j74",
        "stand-j75",
        "stand-j76",
        "stand-j79",
        "stand-j80",
        "stand-j81",
        "stand-j86",
        "stand-k28",
        "stand-k33",
        "stand-k35",
        "stand-k37",
        "stand-k40",
        "stand-k43",
        "stand-k45",
        "stand-k51",
        "stand-k58",
        "stand-k66",
        "stand-k67",
        "stand-k68",
        "stand-k70",
        "stand-k74",
        "stand-k75",
        "stand-k77",
        "stand-ti01",
        "stand-ti02",
        "stand-ti03",
        "stand-ti04",
        "stand-ti05",
        "stand-ti06",
        "stand-ti07",
        "stand-ti08",
        "stand-ti09",
        "stand-ti10",
        "stand-ti11",
        "stand-ti12",
        "stand-ti14",
        "stand-ti15",
        "stand-ti16",
        "stand-ti17",
        "stand-ti18",
        "stand-ti19",
        "stand-ti20",
        "stand-ti21",
        "stand-ti22",
        "stand-ti23",
        "stand-ti24",
        "stand-ti25",
        "stand-travessa-01",
        "stand-travessa-02",
        "stand-travessa-04",
        "stand-travessa-06",
        "stand-travessa-07",
        "stand-travessa-08",
        "stand-travessa-09",
        "stand-travessa-10",
        "stand-travessa-11",
        "stand-travessa-12",
        "stand-travessa-14",
        "stand-travessa-15",
        "stand-travessa-16",
        "stand-travessa-17",
        "stand-travessa-18",
        "stand-travessa-19",
        "stand-travessa-21",
        "stand-travessa-24",
        "stand-travessa-25",
        "stand-travessa-26",
        "stand-travessa-27",
        "stand-travessa-28",
        "stand-travessa-29",
        "stand-travessa-30",
        "stand-travessa-31",
        "stand-travessa-32",
        "stand-travessa-33",
        "stand-travessa-34",
        "stand-travessa-35",
        "stand-travessa-36",
        "stand-travessa-37",
        "stand-travessa-38",
        "stand-travessa-41",
        "stand-travessa-42",
        "stand-travessa-43",
        "stand-travessa-44",
        "stand-travessa-45",
        "stand-travessa-46",
        "stand-travessa-47",
        "stand-travessa-48"
      ],
      "source": {
        "file": "BIL26-0526.pdf",
        "page": 1,
        "type": "pdf-map"
      },
      "strokeType": "solid-black",
      "visualRepresentation": "legend-swatch"
    },
    {
      "description": "Área de atividade cultural, conforme a legenda do mapa.",
      "fillType": "horizontal-linear-gradient",
      "id": "cultural-activity",
      "legendOrder": 2,
      "normalizedName": "atividades culturais",
      "originalColor": {
        "gradientSamples": [
          "#FEEDEC",
          "#FFFFFF",
          "#FEEFEF"
        ],
        "representativeHex": "#FFF1F1"
      },
      "originalName": "ATIVIDADES CULTURAIS",
      "relatedElementIds": [
        "poi-arena-cultural-k86",
        "poi-autografos-1-2-e-3-dd20",
        "poi-convidado-de-honra-espanha-e40",
        "poi-cordel-e-repente-dd10",
        "poi-espaco-infantil-c88",
        "poi-praca-da-palavra-a61",
        "poi-praca-da-palavra-d28",
        "poi-salao-de-ideias-c40",
        "stand-a61",
        "stand-aa07",
        "stand-aa09",
        "stand-aa11",
        "stand-aa31",
        "stand-aa33",
        "stand-aa43",
        "stand-c40",
        "stand-c88",
        "stand-d28",
        "stand-dd10",
        "stand-dd20",
        "stand-e40",
        "stand-k86",
        "stand-ti13",
        "stand-travessa-22",
        "stand-travessa-23",
        "stand-travessa-39"
      ],
      "source": {
        "file": "BIL26-0526.pdf",
        "page": 1,
        "type": "pdf-map"
      },
      "strokeType": "solid-black",
      "visualRepresentation": "legend-swatch"
    },
    {
      "description": "Área de patrocinador, conforme a legenda do mapa.",
      "fillType": "horizontal-linear-gradient",
      "id": "sponsor",
      "legendOrder": 3,
      "normalizedName": "patrocinadores",
      "originalColor": {
        "gradientSamples": [
          "#FDFDEF",
          "#FFFFFF",
          "#FEFEF0"
        ],
        "representativeHex": "#FEFEF2"
      },
      "originalName": "PATROCINADORES",
      "relatedElementIds": [
        "stand-a55",
        "stand-b30",
        "stand-d20",
        "stand-g38"
      ],
      "source": {
        "file": "BIL26-0526.pdf",
        "page": 1,
        "type": "pdf-map"
      },
      "strokeType": "solid-black",
      "visualRepresentation": "legend-swatch"
    },
    {
      "description": "Área de entidade, conforme a legenda do mapa.",
      "fillType": "horizontal-linear-gradient",
      "id": "entity",
      "legendOrder": 4,
      "normalizedName": "entidades",
      "originalColor": {
        "gradientSamples": [
          "#E8D4E7",
          "#FEFEFE",
          "#EBD9EA"
        ],
        "representativeHex": "#EEDFEE"
      },
      "originalName": "ENTIDADES",
      "relatedElementIds": [
        "poi-auditorio-a39",
        "poi-espaco-bem-estar-k32",
        "poi-estudio-podcast-k26",
        "poi-influenciadores-by-skeelo-k24",
        "stand-a39",
        "stand-aa13",
        "stand-aa29",
        "stand-cc26",
        "stand-cc28",
        "stand-dd27",
        "stand-g58",
        "stand-g60",
        "stand-h30",
        "stand-k24",
        "stand-k26",
        "stand-k32",
        "stand-k38",
        "stand-k42",
        "stand-k54",
        "stand-travessa-03",
        "stand-travessa-05",
        "stand-travessa-20",
        "stand-travessa-40"
      ],
      "source": {
        "file": "BIL26-0526.pdf",
        "page": 1,
        "type": "pdf-map"
      },
      "strokeType": "solid-black",
      "visualRepresentation": "legend-swatch"
    },
    {
      "description": "Área de infraestrutura, conforme a legenda do mapa.",
      "fillType": "horizontal-linear-gradient",
      "id": "infrastructure",
      "legendOrder": 5,
      "normalizedName": "infra",
      "originalColor": {
        "gradientSamples": [
          "#EBFFFE",
          "#FEFFFF",
          "#F0FFFF"
        ],